{"$schema":"release-identity-v1.schema.json","schema_version":1,"brand_name":"Veyora","pronunciation":"vee-OR-uh","statement_en_us":"Veyora — Your private digital space.","release_version":"v1.0.0","component_version":"1.0.0","wordmark":"text-only","logo_status":"none-approved","trademark_registration_status":"not-claimed"}
